Spell Name,Type,Pronunciation,Description,Seen/Mentioned
Multicorfors (Multicorfors Spell)[],Transfiguration,mull-tee-COR-fors,Multicorfors is a charm used to change the colour and style of one's clothing.[10],N/A
Mutatio Skullus[],Dark charm,myoo-TAY-toh SKULL-us,"Mutates the victim's head, causing them to grows extra heads.","Used by Ancient Egyptian wizards, as noted by Ron Weasley in 1993."
Nox (Wand-Extinguishing Charm)[],Charm,NOCKSS,"Extinguishes wandlight. It the counter-charm for the Wand-Lighting Charm, Lumos.","In  1994, Harry Potter and Hermione Granger used this spell to turn off their wand-lights in the Shrieking Shack.  Used in 1998 when Harry was in the passage beneath the Whomping Willow which leads to the Shrieking Shack. Lumos's power can be arranged so that a powerful wizard can make the charm illuminate intensely or to the wizards liking by loudness of incantation. For example ""LUMOS!!!"" would be powerful and ""lumos"" would be weaker. Also used by Harry Potter in 1998 to turn off the light so he could hide the Marauder's Map from Severus Snape."
Nebulus[],Charm,NEH-bu-lus,Creates fog from the tip of the wand.,"In 1927, Albus Dumbledore used this spell to conjure a fog in London to provide concealment for his meeting with Newton Scamander."
Oculus Reparo[],Charm,N/A,Mends eyeglasses.,Used by Hermione in 1991 and 1992 to fix Harry's glasses.
(Obliteration Charm)[],Charm,N/A,Removes footprints.,"Used by Hermione in 1995 to remove the footprints that she, Harry, and Ron left in the snow while walking to Hagrid's Hut. Also used in 1997 by Hermione to remove the footprints she and Harry left behind them in the snow as they journeyed through Godric's Hollow."
Obliviate (Memory Charm)[],Charm,oh-BLI-vee-ate,Erases specific memories.,"First seen in 1993 when used by Gilderoy Lockhart on Harry and Ron; the spell backfired due to a faulty wand, costing Lockhart most of his own memory. Also, Hermione Granger used this spell to wipe her parents memories in 1997. Again, it was used in 1997 when Hermione Granger used the spell on 2 Death Eaters who had followed Harry, Ron, and Hermione after their escape from Bill Weasley's and Fleur Delacour's wedding."
Obscuro[],Conjuration,ob-SKYUR-oh,Blindfolds the target.,Used by Hermione Granger in 1997 to obstruct the portrait of Phineas Nigellus's view of their location.
Oppugno (Oppugno Jinx)[],Jinx,oh-PUG-noh,Causes targeted objects to attack a victim. It is particularly effective in conjunction with the Bird-Conjuring Charm.,Used by Hermione Granger in 1996 to attack Ron Weasley with a summoned flock of canaries during an argument.
Orbis[],Jinx,OR-biss,Sucks the target into the ground.,N/A
Orchideous[],Conjuration,or-KID-ee-us,Conjures a bouquet of flowers.,Used in 1994 by Mr Ollivander to test Fleur Delacour's wand. Probably used non-verbally by Tom Riddle to present flowers to Mrs Smith.
Oscausi[],Dark charm,os-SCOW-zee,"Seal someone's mouth shut, making it appear it was never there.","Used by Leta Lestrange on a girl from Gryffindor when they were both in their third year at Hogwarts. The Gryffindor girl was speaking ill of Lestrange behind her back until Lestrange emerged from hiding nearby, and muted the Gryffindor girl with this spell."
Pack[],Charm,N/A,Packs luggage.,"Used in 1994 by Remus Lupin in his office, and in 1995 by Nymphadora Tonks, once verbally and again non-verbally."
(Pain extraction spell)[],Unknown,N/A,"Invented by Isidora Morganach, this ancient magic spell could extract the feeling of pain from an individual.",Used by Isidora Morganach throughout the 15th–16th century.
Papyrus Reparo[],Charm,N/A,Mends torn pieces of paper.,This spell was used by Newton Scamander in 1927 to restore a torn postcard from Porpentina Goldstein addressed to Queenie Goldstein.
(Patented Daydream Charm)[],Charm,N/A,Gives the spell caster a highly-realistic 30-minute daydream. Side effects include mild drooling and a vacant expression.,"These were invented by Fred and George Weasley and sold in 1996 at their joke shop, presumably in the form of some kind of physical object, similar to Skiving Snackboxes."
Partis Temporus[],Charm,PAR-tis temp-OAR-us,Creates a temporary gap in the target.,Used by Albus Dumbledore in the Crystal Cave in 1997. He uses it so that he and Harry can pass through the ring of fire used to ward off the Inferi.
(Pepper Breath)[],Hex,N/A,Gives the victim fiery hot breath.,Harry Potter learned of this hex from Basic Hexes for the Busy and Vexed while researching spells to use during the Triwizard Tournament and decided not to use it against the dragon he would face in the First Task.
Periculum[],Charm,pur-ICK-you-lum,Produces a burst of red sparks.,
(Permanent Sticking Charm)[],Charm,N/A,Sticks objects permanently in place.,"First mentioned in 1995, when Sirius Black suspected that his mother's painting was fixed to the wall with such a Charm. It is implied that the portrait in the Muggle Prime Minister's office also has such a charm on it."
Peskipiksi Pesternomi[],Charm,PES-key PIX-ee PES-ter NO-mee,"The one time it was used, it had absolutely no effect.[51]",Used by Lockhart to attempt to remove Cornish Pixies.[51]
Petrificus Totalus (Full Body-Bind Curse)[],Curse,pe-TRI-fi-cus to-TAH-lus,Used to temporarily bind the victim's body in a position much like that of a soldier at attention; the victim will usually fall to the ground.[21],"Used in 1991 by Hermione, who was trying to prevent Neville from stopping her, Ron, and Harry from leaving the common room to hunt for the Philosopher's Stone,[21]  in the Hall of Prophecy during the Battle of the Department of Mysteries to petrify Antonin Dolohov who was pursuing him and his friends, and used on Harry by Draco Malfoy in the Hogwarts Express in 1996.[17]"
Piertotum Locomotor (Animation Charm)[],Charm,peer-TOH-tuhm loh-kuh-MOH-tor,Brings animates inanimate targets.[61],"In the Battle of Hogwarts, Professor McGonagall used this spell to animate the suits of armour and statues within Hogwarts, to defend the castle.[61] Also used by Albus Dumbledore to enchant the statues on the fountain in the entrance to the Ministry of Magic Department.[6]"
Piscifors[],Transfiguration,PIS-ee-fors,Transforms things into fish.,N/A
(Placement Charm)[],Charm,N/A,Magically places an object in or on a specific location. Placement Charms can be used to place a bridle on a kelpie to render it harmless and docile.,N/A
Point Me (Four-Point Spell)[],Charm,N/A,Makes the caster's wand point due north.,"Hermione Granger taught it to Harry Potter, who used it during the Triwizard Tournament, particularly to navigate the hedge maze during the Third Task."
Portus[],Charm,POR-tus,Turns an object into a portkey.,Used by Albus Dumbledore in 1996.
Prior Incantato (Reverse Spell)[],Charm,pri-OR in-can-TAH-toh,"Forces a wand to show an ""echo"" of the last spell it performed.","Used by Amos Diggory in 1994 to discover the last spell cast by Harry's wand after it was found in the hands of Winky, a house-elf."
(Proficiency Charm)[],Charm,N/A,Boosts an individual's performance with certain talents.,N/A
(Protean Charm)[],Charm,N/A,Causes copies of an object to be remotely affected by changes made to the original.,"First used in 1995. Hermione Granger put the charm on a number of fake Galleons. Instead of the serial number around the edge of the coin, the time and date of the next meeting of Dumbledore's Army appeared. It is possible that this charm is used on the Death Eaters' Dark Marks."
(Protection Charm)[],Charm,N/A,Enhanced an individual's defence.,N/A
Protego (Shield Charm)[],Charm,pro-TAY-goh,Invisible shield that reflects spells and blocks physical entities.,"First seen in 1995, in which Harry is taught this spell by Hermione in preparation for the third task in the Triwizard Tournament. Albus Dumbledore uses a similar spell which reverses the construction of glass back into sand when Voldemort sent shards of glass to try to stab Dumbledore. Fred and George Weasley enchanted hats they dubbed ""shield hats"" with this spell in 1997."
Protego Diabolica[],Dark Arts,pro-TAY-goh dia-BOHL-i-cub,Conjures a protective ring of black fire around the caster that only affects their enemies.,N/A
Protego horribilis[],Charm,pro-TAY-goh horr-uh-BIHL-ihs,A powerful shield charm against dark magic.,Cast by Professor Flitwick in an attempt to strengthen the castle's defences in the Battle of Hogwarts.
Protego Maxima[],Charm,pro-TAY-goh MAX-ee-Ma,"A powerful shield charm against dark magic. A stronger and bigger version of Protego, especially when combined with other wizards casting it at the same time. Was so powerful that it could also disintegrate people that came too close and tried to enter it.","Cast by Professor Flitwick, Professor McGonagall, Professor Slughorn and Mrs Weasley in an attempt to strengthen the castle's defences in the Battle of Hogwarts."
Protego totalum[],Charm,pro-TAY-goh toh-TAH-lum,Protects an area for an extended period of time.,"In 1997, this was one of the spells used by Hermione Granger and Harry Potter to protect their camp site from unwanted visitors."
Pullus[],"Jinx, Transfiguration",N/A,Transforms things into chickens.,N/A
(Purple Firecrackers)[],Charm,N/A,Causes purple firecrackers to shoot out from the tip of one's wand.,"On 31 October 1991, Albus Dumbledore used this spell to get the attention of panicking diners in the Great Hall when a troll was loose in the castle."
(Pus Squirting Hex)[],Hex,N/A,Causes yellowish goo to squirt from one's nose.,Morfin Gaunt used this spell on Bob Ogden.
Quietus (Quietening Charm)[],Charm,KWIY-uh-tus,Makes a target sound quieter. It is the counter-charm to the Amplifying Charm.,Used in 1994 by Ludo Bagman.
Redactum Skullus (Head Shrink Spell)[],Dark charm,reh-DAK-tum SKULL-us,Shrinks the head of the target. It is the counter-spell to Engorgio Skullus.,N/A
Reducio (Shrinking Charm)[],Charm,re-DOO-see-oh,Makes an object shrink in size. Its counter-charm is the Engorgement Charm.,"In 1997, Harry Potter, after checking his Blackthorn wand on the Bluebell Flames with Engorgio, casts this spell to shorten the formerly enlarged flames."
Reducto (Reductor Curse)[],Curse,re-DUK-toh,"Breaks objects. In stronger usages, disintegrates them.","In 1995, Harry used it on one of the hedges of the Triwizard maze and ends up burning a small hole in it; in 1995, Gryffindors in Harry Potter's year referenced Parvati Patil as being able to reduce a table full of Dark Detectors to ashes, and Harry and his friends later used the spell in the Department of Mysteries against the Death Eaters, shattering many Prophecy Orbs in the process; in 1997, a member of the Order of the Phoenix attempted to use this spell to break down a door which Death Eaters had blocked when the Death Eaters had cornered Dumbledore in the Lightning Struck Tower."
(Refilling Charm)[],Charm,N/A,Refills whatever the caster points at with the drink originally in the container.,"Used in 1996, when Harry noticed that Hagrid and Slughorn were running out of wine."
Reparifors[],Healing Spell,re-PAR-i-fors,"Reverts minor magically-induced ailments, such as paralysis and poisoning.",N/A
Reverte[],Charm,ree-VUHR-tay,Returns objects to their original positions or states.,"In 1927, Leta Lestrange used this spell on the record towers in the French Ministry of Magic Records Room at the French Ministry of Magic Headquarters, in an attempt to flee from pursuing Matagots. This sent all the record towers - previously summoned by Lestrange - flying backwards and spinning back into their original positions in the ground."
Relashio (Revulsion Jinx)[],Jinx,ruh-LASH-ee-oh,Forces the target to release its grip on whatever it is holding.,"Used by Harry Potter against Grindylows in the second task of the Triwizard Tournament. Also used in 1997 and 1998, when Hermione used this spell to free Mary Cattermole from the chained chair and to free the Ukrainian Ironbelly on which they were to get out from Gringotts."
Rennervate (Reviving Spell)[],Charm,RENN-a-vate,Awakens an unconscious victim. It is consequently the counter-charm to the Stunning Spell.,"In 1994, Amos Diggory used it to wake up Winky and Albus Dumbledore used it to wake up Viktor Krum. Harry Potter later used it to try and reawaken a cursed Dumbledore in the seaside cave."
Reparifarge[],Untransfiguration,reh-PAR-i-farj,Used to reverse incomplete transformations.,Found in A Beginner's Guide to Transfiguration.
Reparo (Mending Charm)[],Charm,reh-PAH-roh,Seamlessly repairs broken objects.,Used by Albus Dumbledore and Horace Slughorn to repair damage the latter had done to a Muggle home in Budleigh Babberton where he had been hiding. It was also used by Harry Potter to repair his wand with the Elder Wand
Repello Muggletum (Muggle-Repelling Charm)[],Charm,ruh-PEL-oh MUH-guhl-tuhm,Keeps Muggles away from wizarding places by causing them to remember important meetings they missed and to cause the Muggles in question to forget what they were doing.,"It was used to keep Muggles away from the Quidditch World Cup. Hogwarts was also said to be guarded by the Muggle-Repelling Charm. It was also used by Harry and Hermione on numerous occasions, among many other spells, to protect and hide their camp site in 1997."
Repello Inimicum[],Charm,re-PEH-lloh ee-nee-MEE-cum,Disintegrates the persons entering this charm.,This spell was used by professors Filius Flitwick and Horace Slughorn along with Order of the Phoenix member Molly Weasley to protect Hogwarts Castle in 1998.
Revelio (Revelio Charm)[],Charm,reh-VEL-ee-oh,Reveals secrets about a person or object.,N/A
Reversis[],N/A,N/A,Unknown effect.,N/A
Rictusempra (Tickling Charm)[],Charm,ric-tuhs-SEM-pra,Tickles the target until they become weak with laughter.[40],"By Harry Potter on Draco Malfoy in 1992, when they fought in the Duelling Club.[40]"
Riddikulus (Boggart Banishing Spell)[],Charm,rih-dih-KUL-lus,"A spell used when fighting a Boggart, ""Riddikulus"" forces the Boggart to take the appearance of an object the caster is focusing on. Best results can be achieved if the caster is focusing on something humorous, with the desire that laughter will weaken the Boggart.[63]","Taught by Remus Lupin during third year Defence Against the Dark Arts, where his students had the opportunity to practise the spell on an actual Boggart.[63]"
(Rose Growth)[],Transfiguration,N/A,Causes rosebushes grow at an unusually fast pace.,N/A
(Rowboat spell)[],Charm,N/A,Makes boats row themselves.,N/A
Salvio hexia[],Charm,SAL-vee-oh HECKS-ee-ah,Protects against hexes.,Harry and Hermione cast this spell to strengthen their camp-site's defences against intruders in 1997.
(Sardine Hex)[],Dark charm,N/A,Makes the victim sneeze out sardines.,Rubeus Hagrid once had this spell used on him.
(Sauce-making spell)[],Conjuration,N/A,Conjures a creamy sauce from the tip of the wand.,"Molly Weasley used this spell in August of 1994 to pour some sauce in a pot to make dinner for her family, Harry Potter and Hermione Granger."
Scourgify (Scouring Charm)[],Charm,SKUR-ji-fy,Cleans objects,"First used by Nymphadora Tonks to clean Hedwig's cage in 1995. Later, Ginny Weasley performed the spell to clean up the Stinksap on the Hogwarts Express, also used by James Potter on Severus Snape after he shouted various curses and obscenities at him."
(Sealant Charm)[],Charm,N/A,Magically seals envelopes.,All applicants for wand permits in the United States were required by the Magical Congress of the United States of America to close the envelope in which they sent their applications back to the Wand Permit Office with this spell.
(Sea urchin jinx)[],Jinx,N/A,This spell begins to transform the victim into a sea urchin.,"This spell was used on 2 May, 1998, during the Battle of Hogwarts, by Percy Weasley on an Imperiused Pius Thicknesse.[31]"
Sectumsempra[],Curse,sec-tum-SEMP-rah,"Lacerates the target, as if they have been ""slashed by a sword."" Subsequently, the target can easily bleed to death from the wounds.[58] This curse was invented by Severus Snape, to be used against his personal enemies.[5]","Used by Harry in 1997 against Draco Malfoy,[58] and then later against both the Inferi in Lord Voldemort's Horcrux cave,[4] and Snape used it against George Weasley (was unintentional; aimed for a Death Eater that tried to curse Lupin) in the Order's flight from Privet Drive. Harry learned it in Snape's old Potions textbook. In 1998, the spell is said to be Severus Snape's ""signature"" spell."
(Shield penetration spell)[],Spell,unknown,Annihilates magical enchantments and shields.,"Used by Voldemort to break the enchantments placed around Hogwarts School of Witchcraft and Wizardry in 1998 by Filius Flitwick, Minerva McGonagall, and Molly Weasley."
(Shooting Spell)[],Spell,N/A,Used to shoot objects,This spell was used by Harry Potter and Ronald Weasley in 1997 on their Horcrux hunt in an attempt to catch a rabbit for food.
(Smashing spell)[],Spell,N/A,Produces explosions,N/A
Serpensortia (Snake Summons Spell)[],Conjuration,"ser-pen-SOR-shah, SER-pehn-SOR-tee-ah",Conjures a serpent from the caster's wand.,Used by Draco Malfoy while duelling Harry Potter in 1992.
Silencio (Silencing Charm)[],Charm,sih-LEN-see-oh,Makes something silent.,"First used by Hermione in 1996 to silence a frog and a raven in Charms class, then later used to silence a Death Eater that was trying to tell his comrades where they were."
Skurge (Skurge Charm)[],Charm,SKURJ,Cleans up ectoplasm and frightens ghosts and other spirits.,Taught in second year Charms class.
(Slippery Jinx)[],Jinx,N/A,Makes an object slippery and difficult to hold.,
Slugulus Eructo (Slug-vomiting Charm)[],Curse,N/A,Forces the victim to burp up slimy slugs.,"In 1992, Ronald Weasley attempted to curse Draco Malfoy with this spell after the latter insulted Hermione Granger, but was unsuccessful as his wand at the time was broken, and thus his curse backfired on himself.[64]"
(Sonorous Charm)[],Charm,N/A,"This charm emits a magnified roar from the tip of the wand. This noise disrupts all in its path, and can even be used to harm opponents.",N/A
Sonorus (Amplifying Charm)[],Charm,soh-NOHR-uhs,"Makes the target sound louder. The counter-charm is the Quietening Charm, Quietus.",By Ludo Bagman in 1994 at the beginning of the Quidditch World Cup and by Albus Dumbledore several times in the Triwizard Championship. Used by Lord Voldemort several times during the Battle of Hogwarts in 1998.
Specialis Revelio[],Charm,spe-see-AL-is reh-VEL-ee-oh,Reveals spells cast on objects or potions.,Used by Hermione Granger to find out more of Harry's Advanced Potion-Making book in 1996. Used by Ernie Macmillan to find out ingredients of a potion.
(Sponge-Knees Curse)[],Curse,N/A,"Makes the target's legs spongy, making it difficult for them to walk.",Used during the September 1999 riot that took place at a Puddlemere vs. Holyhead Harpies match. The Puddlemere supporters used this curse against the Holyhead Harpies supporters in retaliation to the Jelly-Brain Jinx.
Spongify (Softening Charm)[],Charm,SPUN-ji-fye,"Softens objects, making them rubbery and bouncy.","This charm is found in The Standard Book of Spells, Grade 1."
(Squiggle Quill)[],Transfiguration,N/A,Transforms writing quills into worms.,N/A
(Stamina Charm)[],Charm,N/A,Increases stamina.,N/A
(Stealth Sensoring Spell)[],Charm,N/A,Detects those under magical disguise.,"In 1996, Professor Umbridge cast this around her office."
Sternius[],Dark charm,"STEH-lee-us, or perhaps STEH-nee-us",A spell that causes the victim to sneeze for a short period of time. This spell is used in duelling to distract the opponent.,N/A
(Stinging Jinx)[],"Jinx, Hex",N/A,Stings the flesh of a target. This spell is also known as,"Harry Potter inadvertently used one on Severus Snape during Occlumency lessons in 1996. It was non-debilitating in that instance, but it is stronger when intentionally cast, as shown by the results of Hermione Granger's Stinging Hex used on Harry Potter in 1998 to purposefully distort Harry's appearance."
(Stretching Jinx)[],Jinx,N/A,Stretches the target.,"Molly Weasley remarked in 1996 that recent growth spurts had made her son Ron and his friend, Harry Potter, look as if this jinx had been cast upon them both."
Stupefy (Stunning Spell)[],Charm,STOO-puh-fye,"Stuns the target, rendering them unconscious.",Often; particularly by a number of wizards and witches (including Dolores Umbridge) against Minerva McGonagall in 1996. It's also taught by Harry in his D.A. meetings.
(Supersensory Charm)[],Charm,N/A,"Grants the caster to have enhanced senses, or to be able to sense things they would not normally sense.",Mentioned by Ron outside of the Hogwarts Express in 2017 as a potential substitute for using mirrors while driving a Muggle auto mobile.
Surgito (Disenchantment Charm)[],Counter-charm,SUR-jee-toh,Counter-charm that can be used to remove enchantments.,"In 1927, Newton Scamander used Surgito to lift an enchantment that was placed on Jacob Kowalski. As a result of the spell, Kowalski awoke from the dreamlike enchanted state, and regained an awareness of reality in the present."
(Switching Spell)[],Transfiguration,N/A,Switches two targets simultaneously.,"Harry contemplated using this spell against his dragon in the first task of the Triwizard Tournament. He considered swapping its fangs for wine gums. Neville Longbottom misuses the spell, transplanting his ears onto a cactus."
(Taboo)[],Jinx,N/A,"A jinx which may be placed upon a word or a name, so that whenever that word is spoken, a magical disturbance is created which alerts the caster of the Taboo to the location of the speaker. Any protective enchantments in effect around the speaker are broken when the Tabooed word is spoken aloud.[65]","This jinx was placed on the word ""Voldemort""; Harry, Ron and Hermione are tracked this way to Tottenham Court Road. Ron tells the other two to stop using the word as he began to fear the name might be a curse, later discovering it to be a Taboo. Later, Harry accidentally says Voldemort's name again, resulting in the trio being caught by Death Eaters and taken to Malfoy Manor."
(Tail-growing spell)[],Hex,N/A,Causes the victim to grow a tail.,"When Miranda Goshawk had her Book of Spells printed, she gave copies to her sisters that had various misprints in them; one such misprint somehow gave her sister Romilda a tail.[16] Timothy Blenkinsop was hit with this hex when he was caught in the crossfire of a Puddlemere United vs. Holyhead Harpies riot."
Tarantallegra (Dancing Feet Spell)[],Charm,ta-RON-ta-LEG-gra,"Makes a target's legs spasm wildly out of control, making it appear as though they are dancing.[40]",First used by Draco Malfoy on Harry Potter in the Duelling Club in 1992.[40]
(Teacup to tortoise)[],Transfiguration,N/A,Transforms a teacup into a tortoise.,Seen on the Scholastic Harry Potter Official Site.
(Teapot to tortoise)[],Transfiguration,N/A,Transforms a teapot into a tortoise.,Third years at Hogwarts School of Witchcraft and Wizardry were required to cast the spell during their final exams.
(Teeth-straightening spell)[],Charm,N/A,Straightens crooked teeth.,"Sir Nicholas de Mimsy-Porpington attempted to use this spell on Lady Grieve at her request, but failed and gave her a tusk instead. He was executed the following morning. After he returned as a ghost, Nearly-Headless Nick recounted the incident in a ballad."
(Teleportation Spell)[],Spell,N/A,Vanishes objects which then appear elsewhere.,"In 1996, Albus Dumbledore  used this to transport Harry Potter's school supplies, clothes, and owl to The Burrow."
Tentaclifors[],"Transfiguration, Jinx",N/A,Transfigures the target's head into a tentacle.,N/A
Tergeo (Wiping Spell)[],Charm,TUR-jee-oh,Siphons liquid and cleans objects.,Hermione Granger used the spell in 1996 to remove blood from Harry's face. It is later used to remove spilled ink from parchment. It was also used in 1997 to clean off a handkerchief by Ron and to dust off a picture of Gellert Grindelwald in Bathilda Bagshot's house by Harry Potter.
Titillando (Tickling Hex)[],Hex,ti-tee-LAN-do,Tickles and weakens the victim.,N/A
(Toenail-growing hex)[],Hex,N/A,Causes the toenails to grow at an extreme and uncontrollable rate.,"In 1996, Harry used this to much applause from classmates, on Vincent Crabbe.[56]"
(Transmogrifian Torture)[],Curse,N/A,Possibly tortures the victim to death.,"Gilderoy Lockhart suggested that it was this curse that ""killed"" Mrs Norris after she was really found petrified on a torch bracket.[66]"
Tribuomnus (Inn Charm)[],Charm,N/A,Causes the quality of food within a location to be improved.,N/A
(Trip Jinx)[],Jinx,N/A,Forces the target to trip and fall over.,"Seen in 1996. It was cast successfully on Harry Potter by Draco Malfoy, when he and other members of the Inquisitorial Squad attempted to round up members of Dumbledore's Army."
(Twitchy-Ears Hex)[],Hex,N/A,Causes the victim's ears to twitch.,Miranda Goshawk recommended this hex to be cast on somebody practising the Shield Charm.
(Unbreakable Charm)[],Charm,N/A,Makes objects unbreakable.,"Hermione Granger used the charm on a jar, in which she put Rita Skeeter in her Animagus beetle form to prevent her from transforming back into a human."
(Unbreakable Vow)[],Spell,N/A,"Causes a vow taken by a witch or wizard to be inviolable; if they should break it, the consequence is death.","Snape made an Unbreakable Vow with Narcissa Malfoy at the beginning of Half-Blood Prince, vowing to help Narcissa's son Draco with a task given to him by Voldemort, and to finish the task should Draco prove incapable. Fred and George attempted to force an Unbreakable Vow upon Ron as children. According to Ron, it causes death when the vow is broken."
