Spell Name,Type,Pronunciation,Description,Seen/Mentioned
(Unsupported flight)[],Spell,N/A,Allows a witch or wizard to fly through the air unaided. Technique invented by Lord Voldemort,"Demonstrated by Tom Riddle during the Battle of the Seven Potters, and by Severus Snape before his ousting."
(Vacuum cleaner spell)[],Charm,N/A,Cleans objects by using the wand to suck up dust like a vacuum cleaner.,Used by Madam Malkin in 1996.
Ventus (Windy Spell)[],Charm,VEN-tuss,Shoots a jet of strong spiralling wind from the tip of the wand.,"Used by Newton Scamander to send away Stebbins on a London street, much to the bemusement of passing Muggles."
Ventus Duo[],Jinx,N/A,A stronger version of the Windy Spell,In Harry Potter and the Order of the Phoenix (video game)
Vera Verto[],Transfiguration,vair-uh-VAIR-toh,Turn animals to water goblets.,Taught by Minerva McGonagall in her Transfiguration class. Also used by Ronald Weasley unsuccessfully in one of his second year classes thanks to his damaged wand.
Verdillious[],Charm,ver-DILL-ee-us,A spell used to shoot green sparks from the end of the wand.,N/A
Verdimillious (Verdimillious Charm)[],Charm,vur-duh-MILL-ee-us,"Produces a jet of green sparks that can be used in duelling, or to reveal things hidden by dark magic.",Taught in first year Defence Against the Dark Arts teacher's office class.
Verdimillious Duo[],Charm,VERD-dee-MILL-lee-us,A more powerful version of Verdimillious.,Learned in first year Defence Against the Dark Arts.
Vermiculus[],"Transfiguration, Jinx",vur-MICK-yoo-luhs,Transforms things into worms.,
Vermillious (Red Sparks)[],Charm,vur-MILL-ee-us,Jet of red sparks that can be used to signal an emergency or as a minor duelling spell.,N/A
Versis[],N/A,N/A,Unknown effect.,N/A
(Victor Rookwood's curse)[],Curse,N/A,Causes the victim considerable pain and illness which lasts for many years.,Victor Rookwood used this curse on Anne Sallow in the 1880s.
Vipera Evanesca (Snake-Vanishing Spell)[],Vanishment,vee-PAIR-uh eh-vuh-NES-kuh,"Vanishes snakes. Subsequently, it is the counter-spell for the Snake Summons Spell.",Severus Snape cast this spell in 1992 at the Duelling Club to vanish a snake that Draco Malfoy had conjured while duelling Harry Potter.[40] Albus Dumbledore also used this spell to vanish Voldemort's snake during their Duel in the Ministry Atrium.[6]
Vulnera Sanentur[],Healing Spell,VUL-ner-ah sah-NEN-tour,"Healing spell that slows blood flow, clears residue, and knits wounds. It is the counter-curse to Sectumsempra.[58]",Used by Severus Snape to heal the wounds of Draco Malfoy caused by the Sectumsempra curse cast by Harry Potter in 1997.[58]
Waddiwasi[],Charm,wah-deh-WAH-see,"Used to shoot small, soft masses of whatever the caster so desires at the target[63]","Cast by Remus Lupin in 1993, on Peeves the Poltergeist, sending a wad of chewing gum up his nose.[63]"
(Washing up spell)[],Charm,N/A,Enchanted dirty dishes to wash themselves.,"It was usednon-verbally by Molly Weasley after preparing breakfast for Harry Potter upon his arrival to The Burrow on 4 August, 1992."
(Weight-loss charms)[],Charm,N/A,Magicaly reduces a person's weight.,Mentioned by Violet Williams during a picnic shared by the teams that were competing at the Intercontinental Wizard's Cup.
Wingardium Leviosa (Levitation Charm)[],Charm,win-GAR-dee-um lev-ee-OH-sa,"Makes objects fly, or levitate.[69]","This spell is taught in early first-year charms classes; this came into good use later in that year, when Ron Weasley performed the spell to knock out a mountain troll;[69] six years later, Harry uses the charm to levitate the side-car of his godfather's flying motorbike; Ron used it again this year to make a twig poke a tree."
(White sparks)[],Charm,N/A,Jet of white sparks. It can be used offensively as a minor duelling spell.,"Following the American National Quidditch team's win at the semi-finals of the 2014 Quidditch World Cup against Liechtenstein, red, white and blue sparks filled the air so thickly it was difficult to see or breathe."
